{"canonical_profile":"yuho.sorted-json/v1","changes":[{"category":"artifacts","classification":"unchanged","identity":"2408d0a51cd717a8734137f246be3eb4331a9955a312fd24ce5a778393c27821","new_record_digest":"f78adde4e7b4bfbe8984fb9198de323b4894e493b4ea5e83f6ffb5e3f2025ec6","old_record_digest":"f78adde4e7b4bfbe8984fb9198de323b4894e493b4ea5e83f6ffb5e3f2025ec6"},{"category":"artifacts","classification":"unchanged","identity":"a8cdd76642f0ecda0067f4d780d027935959e42dc16520220f295191b913efba","new_record_digest":"ce568a3778c715c0f837c28f927131dcb32917957cfd39af10c6b894e0a8e3a6","old_record_digest":"ce568a3778c715c0f837c28f927131dcb32917957cfd39af10c6b894e0a8e3a6"},{"category":"legal_sources","classification":"modified","identity":"src:main","new_record_digest":"60f707c123fea1b5d9c7ca99d64e6da8fd45b1b28bbdee8f14b45aad4644fa9a","old_record_digest":"f9b794bb7b25855b9b75cb44bc597a93814b954d436460e579a3e172d412ecd3"},{"category":"work_groups","classification":"unchanged","identity":"work:synthetic","new_record_digest":"4c87ca6367a3ed1ba8563be99f64e13969c0e46a0f39ce8f1a77ed1eee594e09","old_record_digest":"4c87ca6367a3ed1ba8563be99f64e13969c0e46a0f39ce8f1a77ed1eee594e09"},{"category":"expression_groups","classification":"unchanged","identity":"expression:synthetic:1","new_record_digest":"4c87ca6367a3ed1ba8563be99f64e13969c0e46a0f39ce8f1a77ed1eee594e09","old_record_digest":"4c87ca6367a3ed1ba8563be99f64e13969c0e46a0f39ce8f1a77ed1eee594e09"},{"category":"manifestations","classification":"modified","identity":"manifestation:text:1","new_record_digest":"60f707c123fea1b5d9c7ca99d64e6da8fd45b1b28bbdee8f14b45aad4644fa9a","old_record_digest":"f9b794bb7b25855b9b75cb44bc597a93814b954d436460e579a3e172d412ecd3"},{"category":"semantic_mappings","classification":"unchanged","identity":"f:root|src:main|supporting_context|a8cdd76642f0ecda0067f4d780d027935959e42dc16520220f295191b913efba","new_record_digest":"16f1b76e8727ac14c9320ea251534a83f02d931b2dd59e6de9c7252961a6b6d0","old_record_digest":"16f1b76e8727ac14c9320ea251534a83f02d931b2dd59e6de9c7252961a6b6d0"},{"category":"semantic_mappings","classification":"unchanged","identity":"p:root|src:main|supporting_context|a8cdd76642f0ecda0067f4d780d027935959e42dc16520220f295191b913efba","new_record_digest":"dcceb0265b07a5149f2a0cc2ef2971e24ba4d5d8e2bd96fbb994d8950935263d","old_record_digest":"dcceb0265b07a5149f2a0cc2ef2971e24ba4d5d8e2bd96fbb994d8950935263d"},{"category":"semantic_mappings","classification":"unchanged","identity":"pen:root:1|src:main|supporting_context|a8cdd76642f0ecda0067f4d780d027935959e42dc16520220f295191b913efba","new_record_digest":"d68c67ed88931973651091668770c37e980997d7bb8fe734c4da58fa31f53551","old_record_digest":"d68c67ed88931973651091668770c37e980997d7bb8fe734c4da58fa31f53551"},{"category":"semantic_mappings","classification":"unchanged","identity":"r:root|src:main|supporting_context|a8cdd76642f0ecda0067f4d780d027935959e42dc16520220f295191b913efba","new_record_digest":"49e4058893ef800397275eaf48f30fe65b8fd08229c2cfd9cc99a60406e0173b","old_record_digest":"49e4058893ef800397275eaf48f30fe65b8fd08229c2cfd9cc99a60406e0173b"},{"category":"semantic_mappings","classification":"unchanged","identity":"term:fixture|src:main|supporting_context|a8cdd76642f0ecda0067f4d780d027935959e42dc16520220f295191b913efba","new_record_digest":"0d479903aa4d6eb8e64eaa001410fba763efda651f82e4e27ffbbc20be2808c4","old_record_digest":"0d479903aa4d6eb8e64eaa001410fba763efda651f82e4e27ffbbc20be2808c4"},{"category":"scope","classification":"unchanged","identity":"expression_id:expression:synthetic:1","new_record_digest":"2bd20dd9b83577897d1bc348272ed91c4ff61ba79f001161ded62ba0d6dae56d","old_record_digest":"2bd20dd9b83577897d1bc348272ed91c4ff61ba79f001161ded62ba0d6dae56d"},{"category":"scope","classification":"unchanged","identity":"field:coverage_mode","new_record_digest":"484cb77f53e0df5e11370c53524a758e499b4ec593e6c411f2b996c5150e082e","old_record_digest":"484cb77f53e0df5e11370c53524a758e499b4ec593e6c411f2b996c5150e082e"},{"category":"scope","classification":"unchanged","identity":"field:jurisdictions","new_record_digest":"f55f82d740b3b71cfb9ed3bbf6de4908dd49f807b93963b33d4a75b5b75d13ef","old_record_digest":"f55f82d740b3b71cfb9ed3bbf6de4908dd49f807b93963b33d4a75b5b75d13ef"},{"category":"scope","classification":"unchanged","identity":"field:limitations","new_record_digest":"ffdca6d42ec0112f38b312a7bec2e3c39ba581d2fadc31c2e19c7a31f0e628fc","old_record_digest":"ffdca6d42ec0112f38b312a7bec2e3c39ba581d2fadc31c2e19c7a31f0e628fc"},{"category":"scope","classification":"unchanged","identity":"field:subject_matters","new_record_digest":"ff2f95e7ae81e8689583c95dbf355d1a706e467eed569eeec0a69c0002eb4780","old_record_digest":"ff2f95e7ae81e8689583c95dbf355d1a706e467eed569eeec0a69c0002eb4780"},{"category":"scope","classification":"unchanged","identity":"field:temporal_context","new_record_digest":"21c9a5e0942d88e7df87f2d9d7b9c86a890df54370f252e7b2ea1a8e92614ecc","old_record_digest":"21c9a5e0942d88e7df87f2d9d7b9c86a890df54370f252e7b2ea1a8e92614ecc"},{"category":"scope","classification":"unchanged","identity":"field:unsupported_capabilities","new_record_digest":"6f50e5366b526ccb9ebdd6bcbcf82ee8b623519879e922f1195d531aafd81d09","old_record_digest":"6f50e5366b526ccb9ebdd6bcbcf82ee8b623519879e922f1195d531aafd81d09"},{"category":"scope","classification":"unchanged","identity":"semantic_id:f:root","new_record_digest":"f48c05b57b210c9a5f2a7c60885a88ddf5a3bb0cd610faab5bc2c771e0462b3f","old_record_digest":"f48c05b57b210c9a5f2a7c60885a88ddf5a3bb0cd610faab5bc2c771e0462b3f"},{"category":"scope","classification":"unchanged","identity":"semantic_id:p:root","new_record_digest":"1bc26f53493bff7cfa24e332822b259435007c070c9248ff64fe1c61a449cab0","old_record_digest":"1bc26f53493bff7cfa24e332822b259435007c070c9248ff64fe1c61a449cab0"},{"category":"scope","classification":"unchanged","identity":"semantic_id:pen:root:1","new_record_digest":"77e930f94639c36a49fcbea8fff1eb18a7905989ae1ec1140cb2e4b94c71c706","old_record_digest":"77e930f94639c36a49fcbea8fff1eb18a7905989ae1ec1140cb2e4b94c71c706"},{"category":"scope","classification":"unchanged","identity":"semantic_id:r:root","new_record_digest":"a3d30b13cacc31345481216290b7e9a1eecd98a8281ae5b5242bbba1ead4a754","old_record_digest":"a3d30b13cacc31345481216290b7e9a1eecd98a8281ae5b5242bbba1ead4a754"},{"category":"scope","classification":"unchanged","identity":"semantic_id:term:fixture","new_record_digest":"6d2b67487242c06e5845280d8b4ad62dfd3a5a8fb29977c2fd510329b08e5600","old_record_digest":"6d2b67487242c06e5845280d8b4ad62dfd3a5a8fb29977c2fd510329b08e5600"},{"category":"scope","classification":"unchanged","identity":"source_id:src:main","new_record_digest":"164eb8f2f2e86b0b20a8f004df1ef4af85ef2c19c5bba95f4e8fcec48757e468","old_record_digest":"164eb8f2f2e86b0b20a8f004df1ef4af85ef2c19c5bba95f4e8fcec48757e468"},{"category":"executable_model","classification":"unchanged","identity":"request","new_record_digest":"7c8ae7783cafc67924a97cd13ddc29de23b8340850728eedfdb309c3c9397bf5","old_record_digest":"7c8ae7783cafc67924a97cd13ddc29de23b8340850728eedfdb309c3c9397bf5"},{"category":"metadata","classification":"unchanged","identity":"canonical_profile","new_record_digest":"b101b9e125ff07a28413b9713111a0d7eb06d59f02548eb39f03559a8119642b","old_record_digest":"b101b9e125ff07a28413b9713111a0d7eb06d59f02548eb39f03559a8119642b"},{"category":"metadata","classification":"unchanged","identity":"hash_algorithm","new_record_digest":"94d3aea56c7cb0e4216370b91f7a08edba5f9a428efdabde9f91160d63fac8f9","old_record_digest":"94d3aea56c7cb0e4216370b91f7a08edba5f9a428efdabde9f91160d63fac8f9"},{"category":"metadata","classification":"unchanged","identity":"model_id","new_record_digest":"517fe82b11caf86576455f96e8a3e6131eeab4e89fe3f0cc586591ea890bcb78","old_record_digest":"517fe82b11caf86576455f96e8a3e6131eeab4e89fe3f0cc586591ea890bcb78"},{"category":"metadata","classification":"unchanged","identity":"schema","new_record_digest":"1422730627a792a764c3febce3345a5ff33f880f5d7e0de9e1b53d742389d262","old_record_digest":"1422730627a792a764c3febce3345a5ff33f880f5d7e0de9e1b53d742389d262"}],"core_relation":"different","directly_affected_ids":["f:root","p:root","pen:root:1","r:root","term:fixture"],"new_bundle_digest":"df06c696832d9bf803b6b7e1505c52c8c627ac0144bccd052390fd1fbb78c4dc","old_bundle_digest":"cb2c9ee194b4eb4080d0c08727b4959edd5c61ff719f9b704fbd04ad03920edd","review_impact":{"new_applicable_asserted_reviews":[],"new_partial_reviews":[],"new_stale_reviews":[],"old_reviews_non_applicable_to_new":[],"review_authentication":"none"},"schema":"yuho.model-bundle-change-set/v1","summary":{"added":0,"modified":2,"removed":0,"total":29,"unchanged":27,"unknown-relationship":0},"wider_downstream_impact":"unknown"}
